{
  "$schema": "https://json-schema.org/draft/2020-12/schema",
  "$id": "https://local-pii.dev/schemas/jobs/job-event-page/1.0.0",
  "title": "Job event page",
  "description": "Bounded cursor page of privacy-minimized job events.",
  "schemaVersion": "1.0.0",
  "type": "object",
  "additionalProperties": false,
  "required": ["schemaVersion", "jobId", "nextCursor", "events"],
  "properties": {
    "schemaVersion": { "const": "1.0.0" },
    "jobId": { "$ref": "https://local-pii.dev/schemas/common/identifiers/1.0.0#/$defs/JobId" },
    "nextCursor": { "type": "integer", "minimum": 0 },
    "events": {
      "type": "array",
      "maxItems": 100,
      "items": { "$ref": "https://local-pii.dev/schemas/jobs/job-event/1.0.0" }
    }
  },
  "examples": [{
    "schemaVersion": "1.0.0",
    "jobId": "job_01J4M91NJK8WAPJ7J95K73CB2M",
    "nextCursor": 1,
    "events": [{
      "schemaVersion": "1.0.0",
      "id": "603df129-c778-4b13-8b2a-0fe745593c8f",
      "jobId": "job_01J4M91NJK8WAPJ7J95K73CB2M",
      "cursor": 1,
      "revision": 1,
      "type": "JOB_CREATED",
      "occurredAt": "2026-08-09T18:00:00Z"
    }]
  }]
}
